rowid,text,party,user,url
173654,"In celebration of #NationalSelfieDay, here are a few of my faves w/ Georgians visiting the @uscapitol #gapol https://t.co/uIRZku9vWM",R,sendavidperdue,https://twitter.com/sendavidperdue/status/877604990994591745
61445,Honored to have such great support. Thank you to everyone who came to the 1st Barnburner. Don't miss the next one:äó_ https://t.co/65sTdgLGSF,R,RandPaul,https://twitter.com/RandPaul/status/783790585043791872
18148,"Are your insurance premiums going up? ""The problem is,...it's not affordable."" #DefundObamacare #UNAffordableCareAct http://t.co/fr2kUfJGge",R,InhofePress,https://twitter.com/InhofePress/status/390530999852871681
30818,RT @spurs: Merry Christmas! Here's a full minute of Spurs dunks from today's win: https://t.co/mEPJRbFUQ5,R,JohnCornyn,https://twitter.com/JohnCornyn/status/813213873637572608
270915,Thanks to representatives from the Arkansas Association of Area Agencies on Aging for meeting with me yesterday. https://t.co/sy4If9Qt9P,R,SenTomCotton,https://twitter.com/SenTomCotton/status/849660512560435204
267240,"I'm thrilled to work with @marcorubio &amp; @purduemitch to make higher education more affordable and accessible. https://t.co/Iadeq8YEH4",R,SenToddYoung,https://twitter.com/SenToddYoung/status/827174371475066880
6073,"What's happening at the VA is unacceptable, they have created a system to serve bureaucrats not patients http://t.co/MerxxsXiWv #LASEN",R,BillCassidy,https://twitter.com/BillCassidy/status/467356077018062848
13831,#UNI volleyball   Set 1 we won ovr SoIllinois 25/14,R,ChuckGrassley,https://twitter.com/ChuckGrassley/status/789985344812789760
34759,Alaskans support offshore Arctic development. I applaud @POTUS's commitment to explore development opportunities:äó_ https://t.co/UUgvFLqDhZ,R,lisamurkowski,https://twitter.com/lisamurkowski/status/858047411750666244
21353,Direct payments have become a symbol of largesse and whatäó»s wrong with agriculture policy.  Time they are eliminated. http://ht.ly/5CsOm,R,JeffFlake,https://twitter.com/JeffFlake/status/90802476697137152
238205,RT @SBAgov: Today's the day! Are you ready to #ShopSmall? #SmallBizSat https://t.co/wFAwAdMTEd,R,SenRonJohnson,https://twitter.com/SenRonJohnson/status/802501037747793920
14242,"Good to see Iowa advocates Jaclyn Strube, Chaney Kurtz + Melodee Pomerantz at panel discussionäó_ https://t.co/qevehCyuWC",R,ChuckGrassley,https://twitter.com/ChuckGrassley/status/746033156378230784
52249,RT @SenateMajLdr: It's been 30 years since we lost #Challenger. Today we honor our brave astronauts &amp; their commitment to exploration. httpäó_,R,McConnellPress,https://twitter.com/McConnellPress/status/692791891906170881
217336,"""Students suffer ObamaCare sticker shock as premiums soar, plans get cut"" http://t.co/0Jw5mS1E7V",R,SenJohnThune,https://twitter.com/SenJohnThune/status/402808521047437312
179051,Congrats to the @NevadaWolfPack boxing team on winning the 2015 @NCBABoxing National Team Title! Story via @rgj http://t.co/o8ZL1Z81CU,R,SenDeanHeller,https://twitter.com/SenDeanHeller/status/588027599315722242
21871,We can streamline the VA Choice Program &amp; support community providers. How? Learn more: https://t.co/1foAKDCecm https://t.co/FZH5rTWYKn,R,JerryMoran,https://twitter.com/JerryMoran/status/839581609527504903
272062,Join me in celebrating #NPS100 birthdayäóî I encourage you to take advantage of our national parks in AR! https://t.co/FpgSxJaMtc,R,SenTomCotton,https://twitter.com/SenTomCotton/status/779730397429174272
163918,Just announced new grants to help strengthen communities &amp; create a jobs-friendly environment in #WV. Details here: https://t.co/xXHoaccdTA,R,SenCapito,https://twitter.com/SenCapito/status/870296055686062080
252553,US Now Faces Even 'Tougher' Debt Crisis: Sen. Shelby http://t.co/TVwXjzCM,R,SenShelby,https://twitter.com/SenShelby/status/286905198830571520
266226,.@fayobserver: Protection for Fort Bragg's 440th Airlift Wing included in defense spending bill.  http://t.co/IktbvewZ9e #ncpol,R,SenThomTillis,https://twitter.com/SenThomTillis/status/649322078169112576
216888,".@nancook on my bill to combat long-term joblessness: ""Making a Move to Counter Unemployment &amp; Boost Social Mobility"" http://t.co/6BhjMBsMZ4",R,SenJohnThune,https://twitter.com/SenJohnThune/status/479659286793302016
126899,"At #fbboost event: ""Washington needs to do all we can to help small businesses start, survive &amp; grow."" https://t.co/dJtkSJF0Qw",R,SenatorRisch,https://twitter.com/SenatorRisch/status/900755334658228232
213605,"Must-read @WSJ: ""Ending the Catfish Fight: The Senate can roll back protectionist barrier to freer trade with Asia"" https://t.co/inyOfN1nmm",R,SenJohnMcCain,https://twitter.com/SenJohnMcCain/status/735204939090268160
68388,"Have something we can help you with? My staff will be in Harrisonville Thurs, June 23, at 9am: https://t.co/T4vLhtzWpH",R,RoyBlunt,https://twitter.com/RoyBlunt/status/745273590233210882
163767,Sat down w/ @FCC nominee Brendan Carr yesterday &amp; stressed the importance of one of my top priorities - closing theäó_ https://t.co/QaMJiMtP8P,R,SenCapito,https://twitter.com/SenCapito/status/885523634974076928
283083,@Phillies_chants audibly.,R,SteveDaines,https://twitter.com/SteveDaines/status/832375177807851520
33710,"ISIL is large, rich, and entrenched. If I were president, they would be small, poor, and on the run. https://t.co/Nq2EAE76Sv",R,LindseyGrahamSC,https://twitter.com/LindseyGrahamSC/status/674581020243398656
53430,Congratulations to Amelia of @GreathouseElem! Enjoyed seeing you in the office today.  https://t.co/hg8lr2IzXe,R,McConnellPress,https://twitter.com/McConnellPress/status/595644740772765696
235914,"The #RAA will make federal regulations smarter &amp; more effective so they better support biz, families, &amp; job creation:https://t.co/ciMAga3Bu6",R,senrobportman,https://twitter.com/senrobportman/status/858753066983714816
175092,Iäó»ve joined @SenOrrinHatch @SenMikeLee @SenTedCruz @RandPaul in introducing Mens Rea Reform Act. More @DailySignal: https://t.co/FKfJDHOGG8,R,sendavidperdue,https://twitter.com/sendavidperdue/status/669172759109464064
143487,"Voted for resolution to overturn BLM Rule aka Planning 2.0, returning power back to the states. It now awaits @POTUS's signature. #planlocal",R,SenatorWicker,https://twitter.com/SenatorWicker/status/839241531206795264
18736,RT @SASCRepublicans: WATCH LIVE: SASC hearing on nominations to CENTCOM &amp; AFRICOM. http://t.co/pElux5qc,R,InhofePress,https://twitter.com/InhofePress/status/302071736051044352
51837,"_ô__ôWe know we could never repay the debt we owe to our fallen heroes. This #MemorialDay, and every day, let us honor these brave men &amp; women",R,McConnellPress,https://twitter.com/McConnellPress/status/737304447349465089
118551,#HappyFathersDay! Wishing you all a blessed day with family. https://t.co/Cu26Rq9vhg,R,SenatorLankford,https://twitter.com/SenatorLankford/status/744522811343933440
211509,"Glad our bill preserving Vets Choice Program signed into law - our vets deserve flexible, quality care in their cmty https://t.co/GJqvOgZo67",R,SenJohnMcCain,https://twitter.com/SenJohnMcCain/status/897173931144118274
237710,Pastor Jerome Smith from our #JosephProjectWI w/ @WCBizAlliance Tom Fotsch  @POTUS roundtable @WCTC. #WorkforceWeek https://t.co/JHSxlQpCkN,R,SenRonJohnson,https://twitter.com/SenRonJohnson/status/874757113549127680
260582,"RT @GovAbbott: Thank you to the brave men and women who are always ready, always there. https://t.co/q2mwbgW9p6",R,SenTedCruz,https://twitter.com/SenTedCruz/status/808793048477999104
127611,"From the start, I have voted to defund Obamacare. Tomorrow I will vote to oppose cloture and to defund this abomination.",R,SenatorRisch,https://twitter.com/SenatorRisch/status/383349585034215424
236272,"Thx @TheCityClub, @metrohealthCLE, @aarondmarks, @JTharp48, &amp; @KayColbyHealth for all that you do to address theäó_ https://t.co/VYfVbOqrTK",R,senrobportman,https://twitter.com/senrobportman/status/845374067884601344
170702,Thanks to @jaredpolis for defending the honor of the @Broncos on House floor against @DocHastings!,R,SenCoryGardner,https://twitter.com/SenCoryGardner/status/430811417025839104
28257,RT @autodealerstx: Thank you @JohnCornyn for meeting with our dealers and supporting recovery from #HurricaneHarvey https://t.co/aLDz0iYJml,R,JohnCornyn,https://twitter.com/JohnCornyn/status/908773940079857664
259250,Prayers for our friends in Brazoria Co. For those displaced here are shelters in the area https://t.co/gGgUUHBXZX,R,SenTedCruz,https://twitter.com/SenTedCruz/status/901837534413631489
216155,"Enjoyed reading House Mouse, Senate Mouse to the West Central Elementary School 2nd grade class. http://t.co/JGgarRhQyh",R,SenJohnThune,https://twitter.com/SenJohnThune/status/594247352514420738
50990,"RT @SenateMajLdr: Joint statement w/ @SpeakerRyan, @senorrinhatch, @RepKevinBrady re @POTUS' plan for #taxreform, economic growth äå¥ https:äó_",R,McConnellPress,https://twitter.com/McConnellPress/status/857301395908825088
166316,Congrats to @ShepherdRamsFB on Saturdayäó»s win. On to the #NCAADII championship: https://t.co/U1CZfTiVtw via @TheJournalWV,R,SenCapito,https://twitter.com/SenCapito/status/676461427658506241
261267,Congrats to Texans Simone Biles &amp; Madison Kocian &amp; the entire US womenäó»s gymnastics team for bringing home the gold! https://t.co/DyzxhUs262,R,SenTedCruz,https://twitter.com/SenTedCruz/status/763588348984172544
269103,"I also voted for HR 254, Bonneville Unit Clean Hydropower Facilitation Act, which passed the House 400/4 http://t.co/pRqyarXmDm",R,SenToddYoung,https://twitter.com/SenToddYoung/status/321988341539147776
62165,"My legislation will create new jobs, put people back to work, and give Americans the chance to succeed. https://t.co/AUngyxZXLG",R,RandPaul,https://twitter.com/RandPaul/status/722447188719243264
19618,"Saddened by passing of former Yuma County Sheriff Ralph Ogden. My condolences to Ralph's friends, family &amp; wife Patäó_ https://t.co/BRzS4yzUkM",R,JeffFlake,https://twitter.com/JeffFlake/status/837005953291730947
228570,RT @nxthompson: Orrin Hatch has anti-trust concerns. But he'd like you please not to call him a hipster. @nitashatiku https://t.co/Iwph8U74äó_,R,senorrinhatch,https://twitter.com/senorrinhatch/status/893246904980692994
251386,Tonight it was my distinct privilege to speak on the Senate floor in support of my friend &amp; our Attorney General Jeäó_ https://t.co/VWjz7c7ecK,R,SenShelby,https://twitter.com/SenShelby/status/829504231203885057
271052,Jim Donovan is a true conservative and exceptionally well-qualified to be Deputy Treasury Secretary. Statement: https://t.co/nKWzRvOa6H,R,SenTomCotton,https://twitter.com/SenTomCotton/status/841814342718885888
22888,Discussing #Ebola response &amp; preparedness this afternoon with @CDCgov director @DrFriedenCDC and Kansas Hospital Administrators.,R,JerryMoran,https://twitter.com/JerryMoran/status/525395304464781312
137070,RIP #ChuckBerry. #Legend,R,SenatorTimScott,https://twitter.com/SenatorTimScott/status/843260212769411072
97121,"Sen. Collins, @MarkUdall offer bill to give FAA flexibility &amp; avoid further disruption to air travel: http://t.co/wHpXdvlS3a",R,SenatorCollins,https://twitter.com/SenatorCollins/status/327486684545556480
143089,"At 844 feet long, The Tripoli (LHA-7) will support a crew of more than 1000 @USNavy Sailors &amp; almost 2000 @USMC Maräó_ https://t.co/YbLyPI3xuH",R,SenatorWicker,https://twitter.com/SenatorWicker/status/908760327860482048
212517,"Must-read @WSJ: ""A Poisoning in #Moscow"" https://t.co/FuwPrCLXZX",R,SenJohnMcCain,https://twitter.com/SenJohnMcCain/status/827927027684610049
282938,"Intent of well placed shot is not to harm an elk, but to kill it. Thx @SecretaryZinke for your horse sense. https://t.co/1L3ZAwiLVt",R,SteveDaines,https://twitter.com/SteveDaines/status/837410047013564421
24927,Thank you for sharing with the committee the benefits of the bill to #Arkansas. https://t.co/xwTnJwLNHl,R,JohnBoozman,https://twitter.com/JohnBoozman/status/887769093104955395
178000,"RT @TMRPA1: Join @CityofReno, @RTCWashoe, @washoecounty, @Aces in helping local seniors in need: https://t.co/8IvaMu0VVF https://t.co/UKRZjäó_",R,SenDeanHeller,https://twitter.com/SenDeanHeller/status/674682389856198657
139342,"RT @RichlandSC: UPDATE: All volunteer and donation requests can be made to one number, 1-888-585-9643. Please call this number... http://t.äó_",R,SenatorTimScott,https://twitter.com/SenatorTimScott/status/651829443577692160
233682,Always a pleasure to have Kansans w/ the Livestock Mktg Association in town. Thanks for stopping by! @sellatauction http://t.co/iSjCD8Wrer,R,SenPatRoberts,https://twitter.com/SenPatRoberts/status/648596518115614720
262428,#Immigration executive actions run afoul of the law. @SenatorWicker &amp; I back up that fact before #SCOTUS hears case: https://t.co/mLvmXJqMpE,R,SenThadCochran,https://twitter.com/SenThadCochran/status/717099856628682752
227988,Hatch statement on the confirmation of Makan Delrahim to lead DOJ's  Antitrust Division. https://t.co/Xca2aQd3xZäó_ https://t.co/BRyHWnaxJ3,R,senorrinhatch,https://twitter.com/senorrinhatch/status/913153052663844872
55494,"Op-Ed: In 1962, the U.S. Senate passed a resolution to establish the U.S. Senate Youth Program (USSYP). #idpol http://t.co/QR8nuI0ti6",R,MikeCrapo,https://twitter.com/MikeCrapo/status/443035199371501568
155952,"Appreciated the opportunity to meet with students, teachers and parents from @usjbruins during their spring break täó_ https://t.co/3aUQ272m6p",R,SenBobCorker,https://twitter.com/SenBobCorker/status/849712662455955457
262033,RT @SenThadCochran: Deeply saddened by the loss of life in today's @USMC KC-130 crash in the Mississippi Delta. Our thoughts &amp; prayers areäó_,R,SenThadCochran,https://twitter.com/SenThadCochran/status/884767408589856768
274539,You can watch my #VeteransDay address here:  http://t.co/ldf2sIbp4h,R,SenToomey,https://twitter.com/SenToomey/status/532211642466304000
259059,#Texans persevere &amp; will prevail! #TexasStrong #TexansHelpingTexans https://t.co/SzuYqqUNA2,R,SenTedCruz,https://twitter.com/SenTedCruz/status/904792243260850177
24566,#Olympics [Spoiler Alert] Congrats to Kansas State student-athlete @Erik_Kynard on his silver medal winning performance in the high jump.,R,JerryMoran,https://twitter.com/JerryMoran/status/232930515970310145
34716,RT @EnergyGOP: Sen. @lisamurkowski @SenDanSullivan @repdonyoung ready to welcome @SecretaryZinke to #Alaska äì¥ä_ç¥https://t.co/ELR7TTC8mx,R,lisamurkowski,https://twitter.com/lisamurkowski/status/868195304729915398
158444,#SFRC markup of Syria Transition Support Act today at 2:15pm ET. Watch it live: http://t.co/2aKSbBIvnL Bill info: http://t.co/a2YgrJhAhs,R,SenBobCorker,https://twitter.com/SenBobCorker/status/336849356177149952
212906,"Congrats @AM34! @AP: ""Scottsdale's Auston Matthews first ever with 4 goals in NHL debut with Toronto Maple Leafs"" https://t.co/gzsO2RRtUj",R,SenJohnMcCain,https://twitter.com/SenJohnMcCain/status/786591105131294720
158524,"Corker: ""her courage, clear thinking and lifelong friendship with the United States continues to inspire us all"" http://t.co/v3jqBYAnZW",R,SenBobCorker,https://twitter.com/SenBobCorker/status/321264567722319873
252563,"Sen. Inouye was a great American, a respected legislator &amp; a loyal friend. My thoughts &amp; prayers are with his family &amp; friends this evening.",R,SenShelby,https://twitter.com/SenShelby/status/280811612389130241
271611,"John Glenn 1921 äóñ 2016, Rest in Peace to an American hero. https://t.co/SDUnww9LlD",R,SenTomCotton,https://twitter.com/SenTomCotton/status/806974463220793349
67806,Are you near Richmond? My staff will be at the Ray County Courthouse from 1-2pm on Oct. 11th. Stop by: https://t.co/RWuagOmWdG #KC,R,RoyBlunt,https://twitter.com/RoyBlunt/status/784139166154002432
217345,Thank you to Claude Hone for sharing his story in Sioux Falls and to all veterans today and every day. http://t.co/ekdvMgZmZ8,R,SenJohnThune,https://twitter.com/SenJohnThune/status/400028209346920448
271117,I joined my colleagues in introducing a resolution to rescind an Obama Administration education regulation: https://t.co/gb90utAZEL,R,SenTomCotton,https://twitter.com/SenTomCotton/status/838841730287951872
168750,Farmers &amp; ranchers impacted by the devastating fires in NE CO can contact my office for assistance. Learn more here: https://t.co/kZMIPnoo5o,R,SenCoryGardner,https://twitter.com/SenCoryGardner/status/844600578042933248
33847,.@POTUS policies are not working when it comes to destroying ISIL. https://t.co/tN2vcB91cj #GrahamPlan,R,LindseyGrahamSC,https://twitter.com/LindseyGrahamSC/status/668138088644804608
212043,"Itäó»s time Rs &amp; Ds come together,recognize natl security challenges &amp; create bipartisan budget agreement instead ofäó_ https://t.co/HVokzKvzET",R,SenJohnMcCain,https://twitter.com/SenJohnMcCain/status/860245165356621825
31976,Speaking with @CBSThisMorning in just a few minutes. Tune in.,R,LindseyGrahamSC,https://twitter.com/LindseyGrahamSC/status/872783744876388354
211310,I'm proud the Senate has incorporated 104 bipartisan amendments to the #FY18NDAA to strengthen the bill &amp; reflect all members of the Senate.,R,SenJohnMcCain,https://twitter.com/SenJohnMcCain/status/908096081740910592
241587,"Our nation lost a true American hero, Jacinto Acebal, the most decorated Cuban-American soldier of the Vietnam War:äó_ https://t.co/wLeHz1bXcz",R,SenRubioPress,https://twitter.com/SenRubioPress/status/852175086509592577
4636,Louisiana has seven college baseball programs ranked in the top 52 of the RPI. Making us proud. https://t.co/0hEU0qpfoG @shreveporttimes,R,BillCassidy,https://twitter.com/BillCassidy/status/733316914622136320
18530,Sen. Inhofe visits first responders at the command center in Moore to discuss the needs to support the recovery. http://t.co/IoG7Y4mfMS,R,InhofePress,https://twitter.com/InhofePress/status/338014496188678144
116315,RT @GAagribusiness: Nice recognition of @SenatorIsakson staffer @tateizanorouke about meetings at @JacksonCoGA. #agribusiness #gapol http:/äó_,R,SenatorIsakson,https://twitter.com/SenatorIsakson/status/631933562179162113
104380,"We are awaiting further technical details, but early reports indicate...",R,SenatorFischer,https://twitter.com/SenatorFischer/status/904373521584939009
68920,"RT @REK100: ""A gentleness of spirit wrapped around a steel will"" to get things done. Sen Roy Blunt describes Dr Bill Danforth. @DanforthCenäó_",R,RoyBlunt,https://twitter.com/RoyBlunt/status/722072818666618880
117676,"Russian hacks are an attack on democracy everywhere. We must take this seriously, support allies &amp; be ready for ouräó_ https://t.co/6wAiSrrarZ",R,SenatorLankford,https://twitter.com/SenatorLankford/status/860922215335854080
173859,Team Perdue attended the groundbreaking for the new Harris County Library. Congratulations to this great community! https://t.co/iOpVTMsXLf,R,sendavidperdue,https://twitter.com/sendavidperdue/status/844293107566940160
242625,.@MarcoRubio Mourns Death Of #BlueAngels Pilot https://t.co/B4qJnSMRvZ,R,SenRubioPress,https://twitter.com/SenRubioPress/status/738820882383134720
21466,"Happy Fourth of July, everyone!",R,JeffFlake,https://twitter.com/JeffFlake/status/17734349150
137048,Good luck @GamecocksWBB today! #MarchMadness #Sweet16 https://t.co/wTy0sDGbZl,R,SenatorTimScott,https://twitter.com/SenatorTimScott/status/845703705836097536
66699,RT @nationalcouncil: Thanks @SenStabenow @RoyBlunt @DorisMatsui @RepLanceNJ7 for working to expand #mentalhealth &amp; #addictions services httäó_,R,RoyBlunt,https://twitter.com/RoyBlunt/status/915683859546681350
31666,"""This is an opportunity for the Trump administration to come down like a hammer on white supremacists,"" Graham said.https://t.co/FFwxaUKDcj",R,LindseyGrahamSC,https://twitter.com/LindseyGrahamSC/status/897603656840773632
21725,"If this bill isnäó»t good for Kansas, it isnäó»t good for me. #healthcarebill https://t.co/gkjI3WK9Gx",R,JerryMoran,https://twitter.com/JerryMoran/status/878003814351208449
243563,Senator @MarcoRubio met with Cuban dissident @antunezcuba earlier today: http://t.co/lbV1LkgAja,R,SenRubioPress,https://twitter.com/SenRubioPress/status/558392873239187456
20777,"If there was ever a better case for changing our Cuba policy, I have not seen it.  Wow. http://t.co/RWsfer09Wn",R,JeffFlake,https://twitter.com/JeffFlake/status/451895225745539073
67189,A victory for every American who believes the Constitution should be read &amp; applied as our founders intended:äó_ https://t.co/Dn9LDt0Wdu,R,RoyBlunt,https://twitter.com/RoyBlunt/status/850400297050529792
226212,Great #CutThisNotThat article in @WSJ: http://t.co/YI6Z6h8T5O President's #sequester threats forcing discussion on spending priorities.,R,SenMikeLee,https://twitter.com/SenMikeLee/status/310047077788962816
208574,This monthäó»s @FargoIncMag focuses on how #UAS is making a big difference in our state. #NDUAS https://t.co/iVoxXo8VWY,R,SenJohnHoeven,https://twitter.com/SenJohnHoeven/status/859124253052076032
73775,"RT @GOPHELP: .@SenAlexander:#Cures has been bipartisan every step of the way. We saw that in the work of @POTUS, @VP, @SpeakerRyan, &amp; @Senaäó_",R,SenAlexander,https://twitter.com/SenAlexander/status/805906941688090624
54759,.@Senate_GOPs are fighting to #FundOurTroops but @POTUS is threatening to veto the #NDAA. Our service members deserve better. #idpol,R,MikeCrapo,https://twitter.com/MikeCrapo/status/651856317859143684
270973,I enjoyed meeting with Arkansans in town for AIPAC this week. Thanks for coming by! https://t.co/TQagVwONWO,R,SenTomCotton,https://twitter.com/SenTomCotton/status/846821758825119745
212134,"RT @CVSHealth: Today, @SenJohnMcCain, @MinuteClinic, @PhxVAHealthcare &amp; @TriWest announce new program to increase #Veteransäó» access to #heaäó_",R,SenJohnMcCain,https://twitter.com/SenJohnMcCain/status/854417746414759936
136964,"Discussed my #OpportunityAgenda, housing and helping folks who are ""credit invisible"" in @BankingGOP Committee todaäó_ https://t.co/bQkndOMtIY",R,SenatorTimScott,https://twitter.com/SenatorTimScott/status/862769753617727493
266455,Great to have NCSU Athletic Director Debbie Yow stop by our DC office today. #GoPack http://t.co/DaHHS8z9mG,R,SenThomTillis,https://twitter.com/SenThomTillis/status/609075514096164864
236145,"Last night, Senate passed my resolution to designate March as ""Nat'l Read Aloud Month."" Read to your kids for justäó_ https://t.co/ZuKYS8azNK",R,senrobportman,https://twitter.com/senrobportman/status/849628102099644416
34909,"Today is Elizabeth Peratrovich Day, to celebrate one of AK's greatest civil rights activists, female leaders, &amp; chaäó_ https://t.co/OLhq216XTJ",R,lisamurkowski,https://twitter.com/lisamurkowski/status/832266794056425473
252486,RT @georgetalbot: Sen. Richard Shelby: 'ObamaCare is a failure' http://t.co/jXh6XnDjWm,R,SenShelby,https://twitter.com/SenShelby/status/363362518653079553
262488,"After 7-yr fight, @USDAFoodSafety today takes over #catfish inspection duties from @US_FDA: https://t.co/1sVp7gFTVT https://t.co/hgSXe9v219",R,SenThadCochran,https://twitter.com/SenThadCochran/status/704709928863158272
74673,#TBT to when Sen. Alexander warned the president premiums would rise under #Obamacare ... 5 _ years ago https://t.co/zFB4UxOKED,R,SenAlexander,https://twitter.com/SenAlexander/status/672500059334967296
19550,Great to spend some time with #Arizona's up-and-coming rural leaders and members of #ProjectCENTRL Class XXV https://t.co/nLZhqFq3rL,R,JeffFlake,https://twitter.com/JeffFlake/status/849385766090407940
230712,"Earlier today Senator Hatch joined @SpeakerRyan in signing #CuresNow, with a number of key provisions he included täó_ https://t.co/uFNKEX9K1n",R,senorrinhatch,https://twitter.com/senorrinhatch/status/806932888847609856
127042,OPED: @SenatorShaheen &amp; I are joining together 2 support America's small biz - this #smallbusinessweek &amp; every week. https://t.co/SlVBOX2qTg,R,SenatorRisch,https://twitter.com/SenatorRisch/status/859432823685599232
225929,Coalition to block and defund #ObamaCare is growing: http://t.co/9zPLdjvrF7 Help keep up the momentum w/ RT #DontFundIt,R,SenMikeLee,https://twitter.com/SenMikeLee/status/359735537566875649
282668,I'm excited to host @SecretarySonny in Great Falls for the @mtagsummit. https://t.co/YJpIigGI4e,R,SteveDaines,https://twitter.com/SteveDaines/status/859872766962565120
231555,Honored to receive this award. Thank you for stopping by! https://t.co/YcerxchFxX,R,SenPatRoberts,https://twitter.com/SenPatRoberts/status/856990161305042946
36654,RT @SenatorTimScott: After tonight we will have already voted on more amendments this year (three weeks) than Democrats allowed in all of 2äó_,R,lisamurkowski,https://twitter.com/lisamurkowski/status/558397829845364736
206430,Todayäó»s positive EIS proves we can move forward w/Jordan Cove #LNG export project while protecting our environment. http://t.co/ePiAlHsmRu,R,SenJohnBarrasso,https://twitter.com/SenJohnBarrasso/status/530837618620366850
16861,#TellusTuesday Are you for #keystoneXL?,R,InhofePress,https://twitter.com/InhofePress/status/555133740608155648
269075,Itäó»s an honor to receive the Public Policy Award from the Nation Association of Mutual Insurance Companies (NAMIC). http://t.co/4JhplCiQHX,R,SenToddYoung,https://twitter.com/SenToddYoung/status/327541515280867329
232863,Pleased the Senate passed #DTSA - impt bill to protect intellectual property &amp; innovation. Another bipar accomplishment for the GOP Senate.,R,SenPatRoberts,https://twitter.com/SenPatRoberts/status/717112474949066752
